id,text,hash
543,I would like to see some development around the Avon River so that we can buy our coffee and sit by the river.,f0f7642de64192059ec58c0305aefd4574ea612fd17a080c547083b52ef173ac
544,We need to celebrate the Avon River.,7539529a21cf35c1d80881dac4fa03a27c44845bca492620fed5db5af2e2f719
545,Making the most of the Avon river.,638b92f4dea82567a70d596fe0c4ea4bf7514c052899773358245276f26a8ef0
546,The Avon river is focal point.,16b2cf3ff309afdd35582a5b42be5d14b86c99e87331bf877b340940ccd6b402
547,"Highlight the River Avon, making it a pedestrian corridor, with a market area close by.",df613f6c9e69e8ca7782981a949be8183de22aa17db8bace9f00233595ce171d
548,We need to be a lot more relaxed about using and beautifying this water way through the central city. Currently there is a no go attitude when looking at river bank enhancements that involve any sort of structure for public use. We need to be much more flexible and open minded with regard to better unitizing the Avon River banks. That we should aim to have a walk way the full length of both sides of the Avon River from the Hospital to Barbadoes Street. The Avon River is our prize jewel and we do not allow people to wander along it easily.,f391a9583f8748ccaf8372a57e46037bdb5ab060acae4a6418fb2fcfd671ee10
549,"Expand the lawn / garden area alongside the Avon, to include a walkway along the length of the river in the CBD & seats & areas for relaxation",ab56adb75f6845c202b6b1653a23b1830183fdeed10a7b4ebc27e7e5d89c9e7b
550,"boulevards along the river, wide pavements for walking ie Melbourne.",a50dc40dd40e50cc0a246c1a3d7299872afb692125fb508099d1f4077155c151
551,Use the river as a green corridor to move thru the city. Remove the roads beside it (like Melbourne or London South Bank).,f54380fce459b3859d7dc4a580e551eaf470dd53df67e719f95915993bd20232
552,Riverside Parks & cafes & bars. Canoeing down the river and order a cake or beer.,5d5888a36ce5f05decbfce43fe51fcbbb539bcc0287a35a208dc12385097b603
553,mixture of activities based around : adjacent to Avon River vibrant tourism focused (cafes etc).,c70d8e2d1438aafb24b20485e62ed43c16cc262652c8f1f7fec74a87ebc056e7
554,River and stream banks becoming walking / biking / park areas enabling people to move about the city with ease and not needing to compete with cars.,cfbac5f40398caa0aad1e06554142d143b504204ac90805814a9230e64e534e9
555,much wider riverbanks incorporating cycleways and walkways right thru central city and beyond,4f116e3ba555b9e49a6436f50014f700cf46082cf656e0714e5bf23a00cf2059
556,A green passage way all the way down the Avon river with walking / cycling access.,50731c96a242ab496f70c922a56919b06f095c5ba1536ce43d82057cbf6b301a
557,green space around avon river with cycleway,c2b528cc309b8970e4d9d91a4e69b48de3413e21e495a493b9c2aa9d99003cd9
558,Make the Avon river more of an integral part of the CBD rather than just happening to meander through. Board walks.,2d870eaa4987335c3f8f10c2b59a1a639fa4b62f523248383fe809dbd8178ef2
559,Cycle paths along river and in main CBD streets.,8e46fdd58a64f462e807c0c202de7f477cfccdf6097607b72ec9b686dc838437
560,I want green spaces and beautifully colourful gardens. And a wide cycle path that follows the Avon out to the sea.,2082a1ee800e5fcfbb3b06aa56d7e8e2b978307ebcd4674cae6ac7f2666bc6f0
561,"I want cycle ways along the river, to encourage cyclists and not cars.",419141ca4a8b22ec95401b72831ad7627b11b2f28e3ff0e343b57dc6401ed289
562,A quiet green space following both banks of the Avon perhaps a cycle way along as well eventually all the way to the estuary.,8b0e1c5e24a05df33ef53c29836c11299234a12b6a5b346e9074fe03bda1c864
563,Maximise the beauty of the Avon river with walkways and cycle ways,725e94591181a9f501a8950c7a9c640ca7c383ee63dd0acc0cb3343537a4ab03
564,An Avon river cycle way.,8a840d28d23d720dde1261cd97a6b3c5b5d9d298bdec8c74ad7f2cf1d7319fab
565,"The Avon River will be maximised, with cycle and walk ways.",96a655dc31978521d9e4b10128e0313588617422e132d0be53cc1f92283400a8
566,Accentuate and connect out Avon river asset to the rest of the city. Close Oxford Street to traffic and make it green.,e71554673c2ccb4882271e7fd390634f89d6976ccc0bc75280f19eb0f2e91a94
567,"Create a green zone along the banks of the Avon River by changing the designation of Cambridge and Oxford Terraces from open road to walkway / cycleway with vehicle access for service vehicles, electric shuttle buses or trams, and taxis at designated points along the route.",fffd3f80256b374c3e47e36300a1cf7481618c32eb4af315d67b4bd46f0802bf
568,Get rid of the road next to the strip and allow use of whole area of river.,327b7b3479d5dc91e6ebc329a2cd548f325ab9c36bbf8123bc83cfac0697e0b3
569,No roads alongside river banks,9c55a2f19dfd14fd238d47b3fcf9cde5c512c36b0b62097e304530d7461dcfaf
570,Use the river as an outlook for cafes & restaurants with paved areas close off the road by the strip and extend the eating / dining area towards the river.,652cdd05fb684413732cda68fe7dee0761de5b8a712694fd2bc17823b446d949
571,No roads or buildings parallel to or within 100m either side of the Avon River.,d375b30c5dab22992fcabf054ff7edabe4ce7e215af14a4dcbb3a3df085ecb35
572,"I want cycle lanes, pedestrian, car parking, public transport, cycle parking. safe sustainable energy efficient, elderly friendly river crossing, shelter.",f24b7de51582cf8886df2695276a176f54915489ee940d6eff1dbdbd0600d6b6
573,"I want open spaces with seats for elderly, mothers, disabled to enjoy parks, and river vistas and entertainment ones, as in Paris.",0a5873a1f224de8949ffabd3008960521edad04268bca6c32fae11528da2f952
574,Native plantings on waterways to enhance and retain banks; also to help keep river waters clean.,44e69dee8171d95a003fa3aa75a132bd066a67c7a7328747baa70973bcd87842
575,More native plantings along the Avon River.,62a52827afcc9bf3c7e08f75b94b17be7ed49f1a9f81e1ecee6b191328790841
576,"I want more open and green spaces with seating make use of the Avon River with seating. Don't plant any natives but have flower beds, hanging baskets for flowers.",fa5e80988c516ae87ea8d3a18587f422aab7d9783be4d27c659f96bb3d5b2bd1
577,"I want use the river well, widen the green next to the river where possible, mix planting some native some English traditional.",6ae002c0023570dbe26f452d03d681af01ae7639904f17c700008c8a14c8c92c
578,"The Avon River is much more attractive when the banks are mown (no tussocks, therefore no rats) European trees and bushes so that the river is visible again.",f26d7b761f07a224877ba8f23458131104083e23a9e628f47689dcabfb24d2a5
579,Small areas just to sit inside and outside along river. Wider bridges over the river including seats.,925e6366b4e0796bb2c68d4de8c0234a6913d9329dc85d07779b1315ef5f4313
580,Use the Avon river all the way out to Brighton. Needs seating and even cafes and walking and cycle paths.,a70f7499da4aa2cec7279ba24ae1e958bd24bedd12efa6384105208d104e923a
581,"Make the river the focal point with lots of seating, tables and greenery either side of it, as well as play areas for children.",e923b56f54ba873dc6a9d600ba093bc6d5cb993638fe6c13b8e17409cf6483b9
582,"I want seating near the river for quiet, reflective times.",735f6f40cc6ea40d80703cdb50a7730776790b502518945aa5c9540a2c5a1b38
583,"Have restaurants and cafes next to the riverside, to create a safe but lovely area in the summer months.",a1a018293cef76cd14f1b4f0c01fd35bffa674ea733062a6876dc7b38dbcfd16
584,cafes right beside river.,00333a91ad8316f43cbd8906a95febcd228310fe58f04de3fbd07ab13e9c196f
585,Make better use of the river for leisure and entertainment,3205f42ace8aef32640cac208d8a2d0f93ee9f9ff9cea468de85f763f444a083
586,Make the Avon River a really lovely river to be round with restaurant beside the river with lots of lights,8bbb31caf66f1a1606b43c36a0cb8ff34a8c4d1062a842d60b7034541e57dbb2
587,"Pubs / restaurants on the river, pleasant relaxation environment",c4e60f6ad583b99211f5128c157f6bf9681ec3c20ecb879846b041bf15d3506e
588,"Dining experiences, especially evening on / by the Avon River, Oxford Terrace, The Arts Centre, culture.",e2059b57a59d019fa7a8a5a92f87c0db3949fe32a14abf217ef021c105e64a02
589,Develop and market Christchurch's point of difference – the river and gardens.,b8f88943723184760d82f654344e0f5259875b08613b00e3cd4fe93df6cece70
590,enhance promote the Avon river as a feature of Christchurch as part of its character with walkways park benches etc,10404da96ef36b4523b09e3a0b1c725d412aedfcf9fbf21cbe5cd9c467077c04
591,Make the avon river a really lovely river to be round with restaurant beside the river with lots of lights.,5a2e7a748dcd59f80dab0559d876e2b8206878299c8d75f32e2e119ac63e9c97
592,"I want wheelchair access to all areas, place to buy organic food, markets, free limited time parking, cheap quality outdoor dining, boating on Avon, lighting bridges, vibrant nightlife.",59ac257e2754faf8ad86103a6cc014f386a324797874060869fa32eb685e389a
593,"I want lighting, music, live entertainment around the river. Make it our heart like Melbourne / London.",54b329979c7239d2bdc8dfc90e5eb1de766e495205644a734b63d6c83e76a270
594,"Open up original waterways, many little streams are boxed up under buildings and roads, bring them back and make them green spaces.",8c612f6b04863edbe9bcaa548c166bce8941877d3aea7fb8c3b80d8dceb55109
595,"I think Di Lucas idea of re finding the old waterways through central Christchurch, landscaping them into a feature of the council city, is a good one.",f37be4b389f481a4715c6e2b641a110a8fbab44b852d4691f62cd4d4bea8bb46
596,"Uncover the buried river tributaries and make them pretty. Do not rebuild on them, not safe.",a4985d276155b461f96c29f5f6b86232c51415cbb4b7d0218f34ae0fcd5b7ede
597,Punting / Kayaking along the Avon River with options to stop for a sandwich and beverage along the way.,fbc00a25bb263ffccb3f0e167d6046c7a7fd792cbddee96f7f5fa5c00c813c6f
598,Walk along / canoe / or sit on a punt – the Avon. There is a focus along the river.,93869a3dd9b05261fc138d2c60a664639930c7a999e2a5c86a13a6cb8d00391d
599,"Boating on the river, displays against the river backdrop, displays on the river, flowers.",a7261abe75006bc7e532fcef79b124de14ef1842ee5b1733be72adfa9028fa96
600,"I don't want motor vehicles screening the Avon from the public. We need to embrace the river more. Maybe an area between Gloucester st and Cashel st on both sides of the river with cafes, restaurants, some housing, small picture theatres and 4 or 5 foot bridges.",88b0ab14d5e7a7dd469c8d063aec7ddd9f5124120d3b0b842f44e979ac5a8661
601,"Make the Avon a focal point. Clear land on both sides of the Avon River. Have footpaths and cycle ways on both sides and foot bridges every so often. Have buskers, ice cream vendors, hot dog vendors, etc..",e040790657ad321535570eaad5fa284b71fd824ea75e6a696c8c032993e71816
602,Rebuild the 19th Century foul and storm sewers to modern standards to keep pollution out of our rivers and clean up the Avon and Heathcote.,6d84b73b89b971a5e116d9c5c18cad904c21d2bcd758c67406429587e013addd
603,"Take better care of our Avon river, reduce pollution and bring back bird life.",2de2012f586a2898a293aedf77ef911d1501df438db01c47916503f5d398de66
604,"Would really love to see Avon river being used as transport, maybe out to Brighton with park stops on the way, or market stops.",fb690639977abe140b8f6ef6027387a92ff8a90c9418bd01c7f7ad4431d304fb
605,Create a green highway around the Avon river all the way to the estuary.,7ec3f4eb2f4767d141c5de0d249e430f67b6520a8b55b99373d3848461c976d5
606,the river highlighted with pretty fairy lights or similar.,37079c16c70559dd886665fd58aa167bb1efe1b8851619f13ccc5c6733cbf436
607,Clever use of lighting showcasing parts of the river and trees,302941af8c650a15519d0dada5321b7e4c97f10fcd52bfa952acb78264f719f0
608,Cafes with seating close to the river,8352fdb57511cbd0344fc54289e81a9e8a90c6ec6385001dbc1d08e9fd52601e
609,Plenty of open space along river edge,209aa1938c889c48f817c0437dd4e836c8b3075022bac1838834594ed38543a9
610,"Clean, green, sheltered, sunny, wide area to walk and bike, tai chi, small performance areas, cafes but also picnic lunch areas",b3e558f4cb4ea280a6fbdeb9b062bb8e2e0c50e4f8a8c4ba43c8fc8a04c45c73
611,A really wide river walk / cycle / roller blade way from the city centre through to Hagley Park with eateries alongside,74d3f38ded16d4807edbb1e72c097286b3f7ed737d46e1d8c16e019d7c39b5bb
612,uninterrupted cycleways with separate walking paths. With spaces for artwork. ideally temporary art,111f3330d4e60d3efeacb5370369604da53203ff6cf8bb4296af6a3428df41cd
613,"Accessible walkways, trees, gardens, cafes-a relaxing space",25f9b1dfa8cf27e536380df4d3a35b58754779c41b3df91fc397f07996e90cfa
614,Wide river banks + nice paths. My wife and I walked city to sea down the Avon the first weekend after we moved to CHC. Market this walk / ride,b830923914e639803c9f34fe192f3fca2398d0eb5da3a1c9ad38f7fd9e1bf8df
615,walkways into other parts of the central city,7c323e097f10700aaf510833083d9e5c4b9b2fe39f80ede2c700ccfc5454d4ca
616,"Have open spaces on every city block for people to have lunch, meet and hang out. water features, cafe style tables and some greenery.",ab7f2bbf1267c92f5e170897d1f430b4d9ab4432fcce9131699f59d55cd9cc5b
617,"Gardens, seats and picnic areas",02e688888db6d35d3e6dc6aae706a6f53d24bc3baea40fd14cd2842fbc9d5ae5
618,"Great seating made with recycled material from the buildings, plaques could be placed in them with info about which building they came from",f0f49a62f003742d919443a5107de16b74944097f664d0a0c499081469217e1a
619,"More places to take families too, e.g., parks, playgrounds",d73853783acd5e2f9b5d777a57b1ada845b658d061863cecdca649ca2d81d69b
620,move roads away from river edge,18991978f31fc72f7c4fdd79d1af1b87e3374483e9e6ab1ad1a6fb9805b03a3d
621,Plants : some areas might have native focus; but others should be predominantly European / English. Many deciduous trees for autumn colour.,78bb2f99ff93725936e8db8bbdbe80d67d836e9dcc00b172ee5e874caa86014f
622,Signs : Street names stylish and visible. House numbers large and placed so easy to spot. Business names discreet and tasteful.,e30b5da53c3ab1953be8c202b7d6983c675fcacdfa6aad2f9b3cf5887e8c4755
623,"loudspeakers, bus / train announcements, museum / public places, any talks / microphone, ensure there's NZSL translation as well so it's fully accessible. Signage is important too. VISUAL would be great for ChCh.",249a98b4032ddc215f977865a2151c248f2e40d2077cd662016e1c4f9b050233
624,"Visually creative space, not commercially dominated by billboards. A limit on advertising visual space.",70fc2767ff6bf100266d725e90d8ea8df6b90a4c723bd0a788d2457b26aab9f7
625,"Signs point you to the river, (like the Thames in London) which is a cycleway, with sculptures, pubs etc..",e37ca4d6cd704edc335f19ff592c8b82b50ac465576b27adb32c0a7bbc09b52e
626,Signage in Hagley Park. Indicate where each path leads. I frequently meet confused tourists.,d4b708af4d3dc4299747fff1ceb024b6df320286f3ea30acd9c17a0a24222240
627,Name quarters or precincts in the central city,4f47e9a5cf73a1ec57739325a2cbf4205f9d9d22714f732ff3323919c174abbf
628,"As a long term resident of the central city I found it was frustrating to live in an area without a name. I propose that names are given to areas of the city encompassing 5 to 10 blocks, such as Victoria for the areas of one or two blocks adjacent to that street, The Bricks for the area around the present fire station, Boat Sheds or Museum for that area. Further suggestions for other areas are St Michaels, Latimer, St Marys, and Courts. SOL was already a welcome start. Giving titles will help define a neighbourhood and foster a sense of community.",69f08a9b637d3df8e26370abf11a003edcccfbd49aeb178b04d14bc5274906aa
629,"Better toilets especially in Square – hard to get to for women, needs to be easier to access",a656621714952a02006daac397ed292c4bb417807fe0695c1a969e5f8c7cc812
630,toilets around the centre of the city.,b8a2f8698a25bb91ce03612556222dcd58dbd6b944288b340d030c616c882b98
631,more well signed toilets; toilets around the centre of the city.,28a28dca5dd7f2805d3ab145d3516b79345099f38c68953f8e5bdf2fc7e7caec
632,More public toilets available across the CDB instead of just one at the square. [ this will make the city ] safe after dark,0454c72b89f599181493a98f96120f0db980f55728af5ac1f144b08c56dc500b
633,clean accessible public toilets and change tables (places like parent rooms),f973a6da0a494bfe961136adc804fab285187ae2d721b05c74bf647f54ae50dc
634,High quality public rest rooms in prominent places are essential if you want people to be comfortable spending time in the central city.,d7f11b7e76c3f8ed5051fedbfda275c29b7713f5fd277c892ac4e0c05d79a021
635,We need to have park and ride systems on the fringe of the city with free shuttles into the central city.,6c73443ee578018bffcccfa4856650feb28545751fed1b48183eecfb968a7313
636,"No through traffic (cars and buses) but have adequate safe / convenient and cheap parking areas surrounding city (e.g. 4 avenues) and good connection to CBD internal transport system (trams, cycleway, mini-metro e.g. Perugia, walkways. Would need to keep some routes open for delivery etc for commercial activities.",422fa79f84175659b8da822af113e0f8084531b0cded3f788e107462ff921715
637,Carparking outside four avenues. Rapid transit into centre (no tourist tams) and within centre. Residents parking only in city centre.,3fa66f515a0b834618ec23d90339655f394f1d477843107fcf4043957fbb9766
638,Less cars with adequate car parking on the periphery of the central city.,4de620997951aef3f1e54c5c914677a85e1f9a1d11fff7cf6c50cde13aa54299
639,Plenty of parking spaces on the periphery.,e7f9f2916503bb4fc17481acbb7a5c7ff5dc7274effe5f846c4bd4882841fe5c
640,No more car parks near the centre of the city,384281fd84a38b1597cc787c5f3fe5bd298a51be0ec0c50c49a0b82a03cc9f7e
641,"park and ride, patrolled safe parking areas on edge of city, cheap mini buses taking commuters in / out of city",3eee91a157b51e49f18989dc3b14abf1ba693651496498f2320f0d0ae5402a82
642,More first hour free in multi-story car parks. More free shuttle buses around central business district.,b42d3094e7b0f38083bd04f94cfc7fba2a734f62da6e3520975b037d0b7a8b93
643,"Do not want to see cars and buses in the central city. Provide ample and easy parking around, good public transport to fringes of CBD, but reserve CBD for pedestrians, cafes and restaurants (with outside space) parks, Boutique shopping",f99f04c006df351287e0ae21eb9b6306c318820f03e746a46589c794e8e1164e
644,"Attractive Park 'n Rides at key points in suburbs. For this to encourage use of public transport, parking must be free and well lit, policed area, works overseas!",a4d437c52db5785ed98b7853c5813ca913fb3fd9ca655cde1dfaeaee70840e65
645,Get rid of parking metres (why go to centre when malls free?,401a8427d23a5784e4c9b5c8105c66d33d2a862abc5002e9765af50104cc6e1f
646,"Parking, parking, parking. Its the one thing suburban malls have over the central city (and its free).",784bb16988a0351ff5a5144fc8aa92ef2b63977ff74a235eaa4c8535f2b584cc
647,"Within the four Avenues, we could make all the two-way streets (and those few one-way side streets) into 30 km / h zones and eliminate all on-street parking. This cuts out the traffic within the city that just drives around looking for a park, it provides additional lanes on the one-way streets to carry the extra traffic diverted from the two-way streets, and it provides space for dozens of â € ˜living streets within the city. Of course, this will require a significant increase in off-street parking. Fortunately we have the empty sections, some of which can be asphalted over and start earning money for the land-owner right now, while parking buildings are constructed in others.",8e50acda6c450b50e0a7a969526eac63d92db819bb35130b314a7c1c7f346994
648,Have car parks located close to each of the four one-way streets. Have lots of public cycle stations on each of the four one-way streets. Inside the four one-way streets make car parking really expensive.,b9944265e323809e6f7beac585f5aa96a59fc7ff6adba13f3e37e9f93a0b98d5
649,"I don't want streets taken up with parked cars, large buses blocking streets and carrying only a few people",00c89da925bef540394d512113980f501b122c0015e480eb086560e4a7848d0b
650,I don't want streets with cars parked all along the sides.,fac49d9d165212d1b96942acd434c3497d3666872515c2962d1636fc45100917
651,Create car parking opportunities off street – integrated into the rebuild so that wide footpaths and attractive space can be created outside retail and create active frontages.,0c8f20a15652678c907e5a5e2c3ba9fe82b7709f5e471da57ff6fe7438981785
652,fewer car parking spaces on roadside,29dfc73ca0f557362dfe09723e01654ab099537af24a1c69dfce458736365159
653,Don't want. car parks taking potential green spaces.,3f40522c563d941971fd6034c5358427223d0942e49a8b11c7311418b7b38e80
654,"Locate car parking buildings on the one-way system rather than within the CBD, to encourage cars to stay outside the central area.",38f52d0cb6a85a1ff7e84cad2db950f4b5f11c35799facde189b10dd44db1dba
655,on empty sites there should be no temporary car parks but compulsory green space until consent for new buildings is granted.,0845b755dfdcfbbc7bbeb7f9141027c165e05aff28d68d46dc23de110291868c
656,I hope the empty lots in the central city aren't turned into car parks.,5d0c92021e9a5bfe3ad900e556d16737a856fa73806f4c26ec6e264a8899babe
657,"Malls, shops disabled accessed. Disabled car parks.",2f67e70223c61484bdbb51bfe7ae51a00f2c632d1ea32cd7c3de29c38470b46c
658,Is underground car parking possible to avoid ugly car parks?,1c0f9aa5bbf81a7863b5ab5ab253e3402650d6136353d22ded29d0f9ae22a506
659,dedicated motorcycle parking spaces,d459ebaa3ede4ab7607ba60f4e2965f7292b4b8da6f047ecf3aa8923857d3fb2
660,This is already increasing so I would like to see more parks for motorbikes and scooters,958db894d0407d076822fd9387a6a0297eb68c3b400766c7bb7219bb8a20d2de
661,Currently the only lockup public bicycle spaces I know of were down Kivers Lane in an area that was not well supervised and made people feel their often very valuable bike was at risk of being vandalized or stolen. If we want to encourage more use of bicycles then we need to provide lock up spaces that are not hidden away.,e859cd7cd8d27e8fba4747e57da53a47bca015506560b2b0448f4b7289b17e12
662,covered cycle parks with good security for leaving your bike while shopping or at work.,a0fbdc04aa36aa4d6e235d55fdc59b8a4df53502bbfeb0825434bbe347072be2
663,"Perhaps the square could transformed into one such area. as for sport, may be a place for watching sport on big screens, a tennis centre.",0e298136d48b439152c7a642abc154f60acc8a251c2ae3fbcea605f65a2cf2df
664,"I want a lake, surrounding the Cathedral, flowing in and out from the river Avon. Make is big enough for recreational activity, like rowing canoeing, wind surfing, etc. and with lots of space around for walking and cycleway around it.",29fa3add4f8a2199fbe3fc796f51b8db311b79f8c7345945840035f0742934e0
665,I would also like a theme park full of trees you can climb with flying foxes between them!,1cf5f808cd5f5c913b6346f86013ef3623d5faa82d61f251a42233a470abc0ad
666,World class water sport area.,8c7467d9e61b60e645fbd4dabb6b9f0b0ca703e1baa9c9af5bfc120b62083dc1
667,A people orientated space for recreation. welcome for all ages and a huge variety of activities.,7c8631d2131abf409d64323da32bd75aa543e1dfc9e95330f569b099123470e7
668,"I think in our new central city we should have a farm, a bit like a zoo, but with only farm animals. And you can hold piglets and baby animals. You can also feed them. Firstly it would be fun for lots of people, secondly it would probably attract lots of people to Christchurch",5fd8fab3027dc403d67435aa275aa6627a7b04b2cd4314b068fffcfeea1f4e95
669,playground / interactive areas.,de7c70aabd597f11266cc2560ccb1039d0e463aa54ab659ceca677faf2c930bc
670,"Covered areas to practice Tai chi, yoga, and any other form of meditative awareness body practice.",52d9c88e26716dd800664f4f9a03dc82874ebcee5e0c934a5d40cb6f92ac35c4
671,"Bring in some sports facilities, swimming pools, and even a cricket green. The cricket green would be a pleasant green space for residents to enjoy and provide an open space.",3275e1976358bda3d277a49c316d87da6997b2b33470afe94dda44197c7e4187
672,Theme park,b25563f0f042b9576f00123cc53c857aa09d2be4fa41049cd81020be4316a439
673,Create big theme parks eg.. Legoland,44cc811b78f76d789f1c72ef5b6fe5909db9b59ec32ed65e21d14bf0a6a9ae21
674,I think the new central city should have more public theme parks like rainbows end,30ddf8605787fbf8f9997f26c4e5ba10be69bbcf12ea0b470ac14b23a3d99220
675,Re-build QEII within the central city environment to encourage the sport fraternity into and as a part of inner city activity. Not isolated as QEII was pre-earthquake.,09a33ea9aaae5c521f4eaa9a9e4d11a4e011ad17a666bad614bf40332ab06b00
676,"Install a free public rock climbing wall in a central, sunny location with easy, medium & difficult sections.",3067f54df88549e880904264662c493b898ed18c0077025e5fb59c92f46ca20e
677,Allow room for more playground areas with lots of trees and flowers to create a nice atmosphere for Christchurch replacing old buildings.,a99f82f474443050c0029bed294fdf02f5cb463c8f0b0c706c19b65580b737bb
678,Have a lot more playgrounds and spaces to relax instead of industrial buildings.,f71ef7aa6b2c6224f8b5dada8fcb0df120b463fd859bf529ecbcd2cbcd4558a2
679,There should be more areas for children to play in the CBD.,1adeab22ae64241e29dc3400c3a7affd209fead66eda535587d38fbb8521a401
680,"Theme park, box forts, metal bars stood up and you could get inside them.",eb7b3bf5e7797d063710537c805c7aa7184a752a523bef6151cfb3ce0b32a898
681,"Water parks – roof top overlooking city, adventure playgrounds.",3ad94cb15d11bd76dda25775e20eaaf6459be258c4b60ee65a9a05e4369fe4e0
682,Wet and really fun places. Flying fox – really tall one.,0742b62252a4e405b7f3ccc33e84fdc2c0fe6cecae619293372e97f2e1342bc7
683,"Skate parks, bmx tracks, swings, band stands, etc, areas for people to play in the City",cf3992dcc2f0cef7f89be1c7c86b40f323709670ed35d57d316d477931d5c812
