id,text,hash
1177,"maintain a central bus exchange, but remove inner city services in exchange for tram, walking and bike ways.",f3d3d1ba35123429e8e755b09046a227d8c1b6893aa2d8e937bf46ea5bd50671
1178,A green pedestrian / cycle only centre with hop-on-off tram transport to perimeter car parking.,19e453b4465695acd317260a58b4088dbc091136109fd19915c17fc2d83319c1
1179,Most buses should terminate and cars should be left in parking areas on outer edge of CBD. Keep the central area for pedestrians.,f27eccaabd1679b372c169bfaaad6541e0b479b9a46bb0525b4aa44197b2847c
1180,"Put 24-7 car parks (& good shuttle bus service) at EDGE of CBD near arterial routes, rather than have to drive through congestion to park.",fc4e92a1163bb22f77bf463bd6476b63e4d2831bd20ade1a0f2ec7049367bc15
1181,Possibly car parking just out of the very centre of the city with shuttles leaving and taking people into the central city and returning to the car parks so all that traffic is not in the heart of our city.,b567ee0b29fa3605326d16562cad36ac9b8536096f10d647e37fedbf7d04e8fe
1182,Slow traffic zone between square and botanic gardens without one ways (Montreal and Cambridge Terrace),b2f42823b02a79a99b1efff0246288e5fca17b98baafc77641d15f478b17c6ae
1183,Manufacturing industry brings traffic and waste disposal issues. Not appropriate in central city.,bad9ae53e0e05c86050fab80cbada9983ac732d18e36f996a864b1b84a55ae22
1184,Keep the city centre free of industrial businesses-reduce heavy vehicles use in the CBD.,f73cf1c791cee74401973c223741933e8d1b33a1b78cca880efe448e884483a1
1185,I want More green space integrated with stormwater treatment systems (the Avon River currently receives vast amounts of untreated stormwater filled with various contaminants).,08cc5c1840df2cafeb18a9428aec3f449cada0bb30be07d6825ab75fc14fa83f
1186,"When re-paving an area, channel stormwater to a rain garden or a swale not into a stormwater pipe. This improves water quality in rivers.",df14219801cb43528e25eeb9e566f572b60fa3da70d3d913a9e3543c0c8c6423
1187,"Green spaces have long been seen as important in reducing storm water runoff. A combination of more ground-level parks and rooftop gardens can reduce the strain on sewers and reduce the burden placed on water-treatment facilities (Johnston & Newton, 2004), particularly important considering the damage caused by the recent earthquakes. They can also help keep pollutants such as cadmium, copper, lead and nitrates from entering the groundwater.",4998dac0303fd0b39fc421f59956606eabba8d338f046d37db6fa1223b242a3a
1188,"Surface Water Management WANTED It is essential that naturalistic methods are utilised to manage the quality and quantity of surface water. That is, porous and vegetated ground surfaces, green roofs, swales and rain gardens, spring flows flowing on a daylit surface (not piped), wetlands adjoining the river corridor.",52c2da4904cad13666a62d66dc1784020c7cec8669b438d180ff0e079a64f5a1
1189,Redesigned storm water systems that don't run into city rivers. New waste systems with separate grey / brown water allowing grey water reuse,6d5e0e6942ea968ffc2b0866345ef2cfa79452952020e8cb67fef7ff7396484c
1190,Celebrate the fact we have the worlds best water. More fountains and drinking fountains on streets and in parks and ban bottled water.,a8debac72e79921df691acd3fcf9c569387999001d60569d77d8975842ba0cc1
1191,Category : Electrical Reticulation. Underground electrical lines are very nice but not practical in earthquake areas. All lines above ground,af8d0475b1494da4fd60eb3e0ad8e2e29f8f9b82c93f2644a7f7b90147d4da02
1192,"Take the opportunity on any road that is dug up to repair services to ensure that all utilities (phone, power, cable TV) are placed underground",f03d536910082bebfb39d897cef246506c9fe1fd7a136b6b42c44a20f226762d
1193,I would like to see satellite sewage works around the city rather than all the waste going to Bromley. Why would we continue to send all the waste to an area that has had severe damage and liquefaction problems. Many smaller works would mean less pipes at risk and people would realise its their problem. These have been used at many other places around NZ and the world and can be made very environmentally friendly.,05bc213156efe5bc3e9550ba5d2179c545456ca840c0135f62d8bfb6beb2f5ba
1194,"Not just central but all over, flexible pipes for water / drains / sewers so they won't break every time there's a shake",2747c691a3ec267bf17ad59d2631268198be6b31d17af04210b7abdf12df891b
1195,"I Don't want dark spaces, traffic jams, rubbish pollution, noise, nightclubs",4120398d7e9b1deed7b2bc2882dcea39c6dc0531a57d6d259d0b2fb8f4f639ff
1196,"Tidy green spaces, more rubbish bins, hire more people to clean up the streets.",4ad73ac9c88aee0f8c970c089166958b31b98cca77d6ee7dd4a8eb0ff14d2bfb
1197,Install the 3 bin recycle system on the CBD streets in the parks etc..,1944a44244b0fe1de11fee42af7a48cae88e74cad7a4202f9f9d4cec22087227
1198,Design areas around buildings to encourage recycling. Discreetly screen rubbish / recycling bins. Use artistic designs for bins. Be bold.,00fe77f959d8bdf687f94cda258bfb8856e822084515f3aacec5cea3749c34a7
1199,High-rise buildings to allow reasonable population density,4f155e9317620aa900f2d96aa82c29390478f114879f5e453a96194c966ac8dc
1200,Be realistic about needing high rises to have enough density for vibrant city.,1ae1d732ea949207889259d96ec29e3c881bc1e1c07b2ffc4f22dfcf1f057c43
1201,Stop urban sprawl by moving to a medium density city model,3ea44ca302f855127a0b83750412e2476d98d779ebd6adcbb989a727e618eeba
1202,"Keep the city compact. The more compact it is the more vibrant it will be, don't fear hi-density, but demand high quality",5d144d7caf397813abd24f1d258e69716b8e02d25ca7b65e11d03d2dd1532dee
1203,inner city vibrancy-this means inner city living and socializing. Higher density housing than what we had pre-quakes. It gives chch soul,e091cd0bb31a285ac196dc85480261d9d86344c69a50c45ecbfb6267533fb1c2
1204,Lots of high density residential in the inner city so there are always enough people around to sustain the cafes etc that people want to see,e50e4ddcf7e741aae512fc23c91137787e8646aa1ff53d7acf69e039cc5f2200
1205,Social sustainability of Christchurch must take into account addressing the need for high urban density in an attractive site that will attract residents and businesses,2e577d7bfe62a35bfbbc8c44cbb6b232ea99a4f445b1b82605ce189681ff6c18
1206,Large amounts of medium density housing,4eac1f41d00418e77531636e2339230d003b19f59a2efed897485ad9764ef941
1207,High population density,40b109f03457e4f9ccc6733a02eb39ac1754c9cfd849531f2a1c7588699ee7be
1208,"High density low rise living with integrated community retail, cafes, pubs",4bd047d0726302ff4c62ca54f64d6754d0f16ab38166609efe4cb730fa4fb559
1209,"Low rise building medium density, markets",b3d39e47193f6f2ab68e8f8bdeaba4ed6d7f65cf577e2899d44021618015ad6e
1210,Minimum of two story buildings to promote higher density living in the CBD,92822c90b30db245ca1b7d55873e2075764e40bb66798e503d3a88f8451824d1
1211,"Parisian / London style high density low rise buildings with integrated retail, restaurants, pubs, offices.",c436c1885265638d34e440de4631d239160c3bbf924698217f9568d2f549a472
1212,"I want small compact CBD, higher density low rise quarters.",2f105c819377350e4a2986599d8875f5156ee1fff763b5810b36d3898cb42c65
1213,"I would not want to see a high-density population in Christchurch, eg like apartment blocks / high density villages with village greens '.",29b42b16a01757c4c0ab306ae9bdb4a9566df5dce1ace5c0f22dac6efe8a38d3
1214,"Housing, Do not want to see multi storey housing, Research has identified people living on top of each other causes conflict amongst neighbours",1271afaeb4d26268970c2aecc7d0e173dbdbef4fdb701126aa77c561bba39b2b
1215,"Safe (low rise, low density)",7ed603dfb5c87857e9c1850502cc23382304969f6806c88e78fda279c4c41188
1216,All great cities have a mix of residential and commercial in at their heart,e4a5adbf3b4840d7c832028d31631c5b103a4189705da3f3d5ed86f524fe5d23
1217,"Low rise, mixed use office / residential / retail / movie theatres / cafes.",cde7aa6963b4ebcf6ac8aa2c9ac97221dcdfce6699787fbe34253ba39cc2c510
1218,"Agree specialist boutique type shops scattered amongst cafes, restaurants and bars",0b79a00923191a03aafe06953837b4780dcdc33b3b06a16aeaf6ae86b55683ef
1219,mixed use inner city development mixing residences with businesses and other facilities / amenities. An inner city to live in and not just to visit.,5307d8e92cd145286f14b8b90b876c683b68a9bbffe57a0d2b6a0d4609705f6b
1220,"a good mix of leisure, learning, living & commerce.",58e1936a50e64833a73ed91d624935bfc08c4a84cca7ca2eab239353cb7bfae5
1221,"Mix of business, lots of diversity, assimilated rather than Lawyer Lane, Café Boulevard '.",770e70be6b9e9c5c5affd51f6918fe00f29594c6f94fbdbb256d35700cb96f1c
1222,Food / culture / art in among businesses,3abb810369ba84e059d78775547926402a7630df8586aa7ae558792dfe817339
1223,"All shops together, makes it dead at night. All restaurants and bars together makes it dead in the morning",d05cdb3f3b53b4d693bf72f74b96dff877f602bdd63124d65de477638e01fbe6
1224,"Truly vibrant cities have a great mix of high end of funky retail cafes apartments, night life mix it up!",224bf87d5c322d4b86b28607685a90b4afd51f7043324e8f2f8d695807ccd4a6
1225,"Mixed use development is KEY. Shops, cafes, etc on the ground floor, nice flats above. Once people live in the city, it will become better.",8426164f1a0b080084b91a649f31dfd234c7df3525940877517c7d77e857741c
1226,"To be a hub for culture, shopping, eating / socialising with good inner city living apartments. Business e.g., lawyers, accountants, etc..",a309edb77fcee51cfd74aaca1428e54d97e2e5e7c58ef09d9981812d52cfaa4c
1227,Mix of business and residential to bring back heart and soul to the CBD.,aac9e6ac0fe70af01e50abfac987d24ca4384daec1f829073833b39a092b61fd
1228,"A good mix of retail, business, culture and entertainment to encourage people of all ages or interests to participate and have a sense of belonging there.",97e462074728accca546f6fee644760553f4547ca0673b8704e534b161f8c34a
1229,A good mix of business and nature and leisure and entertainment. Not so many businesses but more variety,504bd5207f8919def755d57e6b62e346873f8e43799771951e416a927f419a49
1230,"It should be strikingly different to the existing suburban shopping malls, an interesting mix of residential, commercial, business & cultural",427c92849f8dbc81d6a76870518eeb9859aa3a6a76f4e7a9d0ea0c52c1c26447
1231,"Control development within heart to maintain a mix of residential, offices, retail, galleries, cafes, entertainment, cultural facilities & tourist accommodation etc..",ffc044f13ba8408674243d4a57a2446a7fbe5001198b58762523625b60906230
1232,"Music, Culture, Business, Art, Chinatown",a6177b81deb4b67ef2f316487aa54272546cfc7d45ca9e48b332a259c74613bd
1233,"I want diverse business, IT, finance, retail, hospitality, creating a diverse workforce. This diversity creates vibrancy and a sense of inclusiveness for visitors",b6809a549bb4d8fc06397ba98b2a6cd7f77debbe44b5895a57d589a4c1df81c5
1234,"A greater mix of uses, e.g buildings with retail, offices and living together.",304f94b2cf1dd6ff8c5f43f2508500bdec206e03c8c426fd585ba668fac0bb62
1235,"Mixed commercial, residential and retail buildings.",2d35645a6b3ebcb23b90d528acf6bea218b7480a713cf7d003f79284c9e87e80
1236,"Mixed use buildings, residential, retail, commercial like Europe",6acb9d5bc694133715946cc51eea6a6a7b0b404b3ec4676ef771bfdb5a7b5e9d
1237,build rest homes on the upper levels like Europe so the elderly can enjoy & be part of the City,820cbd5ab6b3372f9209bbfc5fae29b13635554948e1ce98134ceb4c746787e5
1238,"Businesses downstairs, offices above, residential above that. Density but lower rise",beee4b933792936f4e43f01648901870b29fda77ba689d339d5de49de5ef5b2f
1239,"Specialist shops – the type that there were only a few of in the whole of Christchurch. E.g. Knitworld, Scorpio, Fazazz, Longhorn leather.",6803923c4fac31d38cb599c831ac27bd3394ebedd45402f9207b376bedbce596
1240,We miss being able to walk around the streets and walk into shops that have individuality and not the same old same.,278adb91a59bb24a2ba76db6e66b124bd7ed69f4b4afaa4f142daf20fe221c1b
1241,Specialist shops that only had one store that was / is inside the cordon.,f992e26564acfd1414ae3d1069f2c0dfe3724096430505cd2a13ed60e36f63c7
1242,More boutique stores for individual orders,5b618df0fc66d38b8d748ded4a8d5bbc7a7ca11bf53e6fcb54499406743a7587
1243,"boutique shops, no malls or chain shops.",0dc6924be7a9b3d7b18f6bc06479b9ec791cf2fa1868a0029a9871dfbfa2b56d
1244,"Access to specialist shops such as shoe repairer, outdoor clothing specialist.",70a6af6d2274e19b25ee24c764854b6aa504f5f87b5a5f8df7ff169f79c71609
1245,"Shops need to be predominantly boutique, unique upmarket fashion, speciality arts etc..",eafcf3229780d344e5bf5c91f6d6eeb9e9b43581207002baa791c68532b6e7bd
1246,Boutique shops not large retail chains / malls.,9216470602f78a4ae2c50d8a57c80b5368f5640eb274ce6c36a1ea80a0800a66
1247,Focus on cafes and bars in the rebuild as a point of difference from the suburban malls.,6d3f31d92d13101789ad658053a70323c79c638855d2e19fd7e795202553b01d
1248,less souvenir shops and more high street and one off businesses to show nz and locally made products to New Zealanders and tourists,b54b2baf5250fd6836323c0525254bba22c0f496ad2e6a85f062e644a35669b0
1249,want pedestrian malls with a wide variety of shopping and cultural activities,084c86dd594d37c20000c3be4ee955ea2f3eb73d256ded05c70c71ca105aef56
1250,car-free shopping streets,d6b14f0e1ba9198c7b31cb49b8f2ca4e55461e7c6b97a67c3f3f7055fa8fe764
1251,Open pedestrian malls (like New Regent street),7d62dd3071bece8c045e7c639f872e6cf9f88d6286c5ed5e3076f0a4fa598ee7
1252,pedestrians mall with seating,fdb2e6282a78e42c38d4a566438872acacb34d08fb622b98d5da0d382e6f28b3
1253,I would like to maintain a pedestrian only city mall.,4f011d99c9d5c64a107086f8321f7087797b72f4f3115ed4db502c4b85342509
1254,I would love to see a pedestrian mall with lots of shops and cafes.,a1ff17c86d135b306977e2d44728716dca0d1cfaff3d802164068c958735a7c8
1255,Possibly Colombo could be pedestrian mall from Lichfield through to Gloucester or Armagh.,2470edcfbb842426752e15a792a3a13ff434eb7e8cf4cbf6ec5db86f166b0606
1256,No traffic pedestrian mall in core of CBD.,4491514ed51ff03734f8d108e1075ddceebe239dac82d83afa5cba9d3bdbe6b2
1257,More pedestrian only shopping streets and street markets would be great,94881a5d9b56a025ffb4ec6177b229121d2d20db6bd227d66694b67e993592c9
1258,"More covered ways between malls (Cashel, High St etc)",c1854317374d71e8d7c0c0e3380ea535c2c35c2e80747a76549279f66ccf109b
1259,covered shopping zones,af273fc88a6b268b2dd2aabbe04d91ca93b62354c0a205506c39d07785b467d5
1260,covered walkways for rainy days,34c3473b9a5ba21fcaaa34fb7ceb3a2ce60514bc91ddb5a9a180614317f925e4
1261,use walkways that are covered (and strong!),c5b75532d28cd216686d7e5686d789989c4b151a486a3ad9854cb9f513b90476
1262,covered walkways for pedestrians.,cc329b0d6c3ebc5510daa9a227cf681fce61fddaa8b2d98d77cdfca294abd733
1263,Covered walkways 4 shelter,4cb69f2cfef134e07802dfa56195b49e652875ef2d37201602264e9e33a1b56e
1264,Covered walkways link shops / offices.,fcf229c4805a7bdd50954ce70019a07bab2b967f1d45547212ba785690f5d852
1265,Enclose Cashel Mall with a glass roof / canopy. (like Fremont Street in Las Vegas). Have the entrance and exit open allowing air to flow through. A clear roof allows sunshine through on a sunny day and keeps the rain out on a winters day.,72531cadb1f5390a52f9ca8580a60f7ef418088e676356fc78a0005e045d952a
1266,covered ways with disability scooter access.,dbab51389556f5e23dccc0cf6590b035be800c7f07194b143ebbe0641cda1615
1267,is an experience and should be considered a something that would involve 4 hours at least not 1 hour mad dash in and out.,3c62114c5388a0385e6705a9f34ebebf1c225f82c67d4d5fd0c144eaeda9a950
1268,"I want Reasons to spend time in the city, farmers markets, the arts, clubs and bars, buskers, street life, restaurants, organised open entry concerts, museums, heritage, boutique shopping",c5730dba67e3b50d4e43f7e03aeb66669e5b93c1033a8581163ee039ff291cad
1269,I don't want rubbish shops on the high street selling stuff that won't last a week,87da0bebe9ff7fef58c2720f706cf6e7ea81566a3e73300536b0347b0cd67d6a
1270,I don't want shops that you can find everywhere else.,0db186929c2099966c53bb380a00349ad899a1f3e699e1f44159eae9b8ebad6b
1271,I don't want stupid pointless shops like two dollar stores and value mart,580d6d9b03a72372dc18243b0b5c1b1ec97985ec9f4a8cfac9946515befb97c8
1272,"There should be none of the scummy sex shops, $2 shops, tacky touristy shops.",6f6a190733181b5461c96d1abc4148211be42246e43356fd0b0c4318485c09f6
1273,I don't want Porn shops and crappy cheap traders a la lower Colombo & Tuam,622f8999a2dd48e4b3bd75e03b234aa54c152146221bf44df919a016d8eb29d5
1274,I don't want Cheap $2 type junk shops,ee5d62d63a44676d2aea1f9d27ad64eeec9ea0e7b4dbf496012a945476e6aac8
1275,the Dux de Lux atmosphere.,14a6a8325e75044457d7435347278964a0a599f3ce4671c872022ff92496ea16
1276,"Local specialty shopping. Ballantynes, McKenzie and Willis, De Spa chocolate shop!",3d23393deb7653146672019debe5ab0dc22691259905013878b87e0449c09ebf
1277,Cultural activities; shopping in town – Ballantynes.,f3dbeaeca899b41ccbd15cbec009560e7ec1434e8176b690bbe23aef799f88e5
1278,"Boutique shops, Ballantynes, art gallery, new regent street, cafes and restaurants, movie theatres.",b4d0545d1fbd438fde1e472920306d97bf01bd07e96ec08ce73c8a3311d8d6fd
1279,I've missed going to Ballantynes and other shops that you can't get anywhere else. I've missed all my favourite cafes and restaurants.,94c211ef9f5f462b72208130723385361e12e7d5588daf2f7638ed59d14e0801
1280,Affordable rent for the little guys so we keep the quirky shops alive. Not just the big franchises.,8e63d9ef85566f653f078721f99bf2708e4314920489162d9a5278865b500160
1281,Work with bldg owners so that rents are not too high for the kind of boutique shops we need in town,4901f6362c728cfcfdf0c4b8130fae8230f713098a0fe51e4924004db8fbaf82
1282,new retail shops need to be modest with rents and rates to match,93cd010c684193005a2875846c60422191761246a284305c88af6f8ce01641b5
1283,"Small businesses, interesting, lively. Need a decent percentage of lower rentals to be talked about now that the bad old cheap buildings are gone.",e9888a49ec258ee150392b555b935a6f5da85981a1567eb19d35f153fab56a4d
1284,I want cheap rental properties to encourage people with talents ie artists / potters / boutiques,ff5ddbf1141d3a9835cd747d58739486132019864a34af250e4f306588159efb
1285,Subsidise rent for small unique food shops to encourage variety,bffe7cce3dd665920e5a80766704ca777e97fc5bb3fcfb615e3f2c2b872f6369
1286,"Keep rates / rentals low encourage boutique, specialist, hobby, startup businesses.",d70f2c07d99afca9c107785a90a6c708d65ada5cd789eb7411b1cef8b3725c8e
1287,"Ask ourselves why are the malls full of people. Don't replicate them but follow their principles of free parking, convenience, ability to go to no matter what the weather.",c1cdc37fac601dde592c9d22508fece6c37cd7e3bfab9137396f192a7df48537
1288,No big malls,2b7e495fe5ea310669335e72ef2eb9c99b9e223b08629cc85550221f31e48970
1289,Malls are cathedrals of consumption.,12e27bedc6fcc23a38b93499c49baad2c2d73891d406c44f75c4445a317423b8
1290,I don't want Big Malls. I 'm not a big fan of them and I much rather stroll along boutiques than get horded around a big mall. They all appear the same.,0957eaaaa404448850cc2b6dad8914b53de33ff47384c4bf23ad2171ec247dfd
1291,I don't want big mega stores. Keep these to the suburbs and specially designated zones.,99161e6255706c8ae4aefd33dd1d5c6c3fa482f3a683130a2fe9d499d8c76837
1292,shops and buildings with their own style and character (unlike the malls),70c39632a2cfd4228ad9516ea091b5664992d92dfb0baa9bdfbbd36e98079da7
1293,I don't think we should have any big shopping malls in the CBD. Shopping malls in other cities usually strip the streets of shops.,7c90804155a015f5ef3b65f63a4c9741a0c5c60805bd2d6c7cae36e0e2dd0040
1294,Small boutique businesses are better than big malls,edbfaeafac615fa0b63d30335f7f06bcfef2aae904896a816499588ac1e3a307
1295,No mall type developments.,678dd5b28781c78c40b0569606aea1b504f887b6d257b7228e46dd41979bbd56
1296,I don't want Westfield!!! and its ilk.,90f24399a4e959e1a2d6394ee61e3c0d2ee5c89cc0ac28cdd9e94c49a30847f6
1297,Don't allow the spread of any more malls.,4638115a27ab3607f880022a43935aa42c23de1407c82de4696e3d22e2707de1
1298,No big malls but streets interlinked with boutique stores as well as some of the bigger stores.,3465e156ee7b954c2780d6e5c0456db6adace06d63c6addb91dd7e82a60606e4
1299,CHC people shop at malls. San Diego and Honolulu have revitalised CDB with outdoor malls.,7f548d20a50fa151ae8664e3bb3022c6d2f324c387db718fadf5a9041fe6d79b
1300,There should be a big mall in the cbd so everyone from around the world will want to come shop in Christchurch and have al the big brands and names in this but make it only 2 or 3 storeys high. it should a couple of blocks wide though,0a7a1cdea79ca07762977034d4406579e8a44aac05338cfe89ea7a29769a1d6e
1301,"shopping mall in inner city, people like malls. Get over that you CCC planners!",798124ff29a34654d35977998e8db87a8832c9f7d149e84222457d885c8b5b63
1302,Have shops open later e.g. 10 am to 10 pm,73909516b9f18eb3cbdc42a55fc3f23d07e8a557266e919d1ebff208bbb808a5
1303,We should encourage the CBD to open later and stay open later as most European cities do. I believe our CBD should open at 10.00 or 11.00 am and stay open till 8.00 pm. Our CBD needs to set itself up as something different from the suburban offering. Office and other workers in the suburbs who finish work at 5.30 or 6.00 pm have little chance of any CBD retail experience. If the City opened later and stayed open till 8.00 pm then we would find workers come to town in the evening as a family to do retail shopping and then stay on for a meal or to catch up with friends in the evening. The city would create its own evening character and life like we see overseas.,332ab8a98620d0ca1c7cc9954b3d40d1d108aef0bc03d69d18f83eece6bac1df
1304,Longer Retail hours up to 10 pm.,4b8f5cfeaf16588bab252f42be04c619dafa216b5123f8a8ea0e3f9a00cb244b
1305,"Would love a small supermarket (similar to UK's Tesco Metro / Sainsbury's), not the overpriced convenience stores that we've had in the past",c654c4428938c615469fcf83e45dbf5865b9c63d488ed8585a1bb21f8fb284ea
1306,Auckland & Wellington already have metro version supermarkets. Encourage the big two supermarket owners to bring them to Chch.,812c4c8ef6a86825aeaf27017dec1ddb6aeaebcbeff34096cbd0f257200cac36
1307,"Micro Supermarkets like Woolworths Metro or Coles Express that sell fresh food and all products, not the overpriced 7-11 etc",d0a56ca31de12c33519c97fbbfdb270bc07d7d4f7e34b64e0e6f6521d3c468c4
1308,A compact metro version of supermarket,d2dd8bc0d88fa2aa4af1b5855470654e23c789ba2c5fadc123bf38631f3314e9
1309,24/7 mini-supermarket,d1ce2c280a6e3e878504dfb6b49226212c1201573b3e48d154c82bcf7e0f7433
1310,inner city supermarkets with good food,3d928086ebc683dbde23780703ad2b8f5dca097c235782451d83cc0a5bf80969
1311,"I want one supermarket, convenient to do shopping while having a good time in the inner city",471d68e785fa1a78b984ec02ffaaab0c8b2b862cdb51edfa6c17ab1eabb9ef23
1312,Regular access to favourite businesses and services.,78c7f8ecca5484fba8cdc865add2f4a8081fa208ed8223924eaa638fd7b46efd
1313,Character shops.,987b36efed649486c1a117a3c29f50972d8507f1fef818beff866ae1059f9e52
1314,look after small businesses.,b8191c232c4bf136bae6b602871bb6b428b57a0aff470e2a5d7efa0bdc52c99b
1315,I don't want Sleazy down market shops and activities,5f90fb77f8e2e97c47b4d7339ee73b84db5a206c01928c16f3e11527f9b2b33b
1316,"Our city was in some ways broken before the earthquakes, too fragmented, grey and whole pockets of dilapidated structures housing dubious operations that were an embarrassment really. Not sad to see them go actually. Our city was in some ways broken before the earthquakes, too fragmented, grey and whole pockets of dilapidated structures housing dubious operations that were an embarrassment really. Not sad to see them go actually.",f99a5047b95ffd56814c2b40aeda23c7dca717af7bbcc1cc705f3ad1c72c1456
1317,No Adult Shops,5ee329ff48eff99fea1486bb66cd391b9324008718799599420467aa91a88501
1318,Get rid of the Massage Parlours,610326c504dfb997929e4ade0393e2c670110d9d89a9a74e25339a6748324067
1319,Get rid of the sex shops in main street.,967db297c011b5dbf9509297101c3bdade30329855b7a5a5003b92c5f876e913
1320,No Manchester Street or shifty brothels,b01d4c27552fcc1c32092e2e7396f1103db1ce2e8503c7744e655499aa915494
1321,No XXXX stores. No legal high shops.,f97c6137a8d11bae5a07f642173886ccc16a10863455f355ebe424d92fc40412
1322,I don't want adult / sex shops on Colombo St!!!!!,a2f6b04ec5de5fde9754ae0b7ea53ff64322a4d6815d7c9b9a0413670da14445
1323,"Ditch the massage parlours, brothels etc!",bb5b5a603298e7d16c45a93e45d328045701a52bb1f0f5bcea7c9940f3680f57
1324,Get rid of the party pill shops!,3e2bc618eb9d682cefea6be9e1d190a7deda17b26047a911c3a5f6ad2b869d6c
1325,I want less souvenir shops and more high street and one off businesses to show nz and locally made products to new zealanders and tourists.,a3780ab4c3d2cb5a9f68fad19b2a2c06d4f1f6537051aad0e582d3d50ae3081b
1326,Also less souvenir shops they're ugly and silly,1cf693c81c00430a2faa38bce171faf260819c0052fba4eb4e8351780c4b287e
1327,"no $2 shops, no sex shops",84433922ef62ae5a9ed9c9e93753f0720274044cb4ff349c6fc59c1e9f0b1fcf
1328,"I don't want tattoo parlours, party pill shops, $2 shops, adult shops, stand alone liquor shops",dc2980825b4477f019727992f7c5bc9c47e18d80a0ed54878437c0793bd83c46
1329,"I don't want low level shops such as two dollar shops, sex shops and other shops that are not of value.",10db019d6378c518ae9548c6c9bb5962179faed5cb40910b946873e3ad9bd8b3
1330,"Low rise in CBD, Cafes and retail on ground, residential and office above.",345c61f98aad2722116d0aa138ac93c93a44b22c94c2c5e9fc4ed69f56c33db9
