id,text,hash
0,"Thousands living in the central city in a wide range of housing. Especially highrise. LA, Taipei, Kobe-they're not afraid of tall bldgs",39ea774e66ccbebf8297542965c8d4cc3b434ddc7cfd32140ee12e7121041bc9
1,"I believe that the city centre (CBD) should be of high density with medium rise building of 7, 8 and 9 stories high.",a96d7661f0567865be9e569a062bb5c5c2804db49e311aeccf2bc86a3a907a4a
2,New buildings of 3-4 floors will help keep people in the centre. High pop. density brings life to cities and creates economic viability.,c45e85656fce6eecf3d8700f5eb3ceeb388fefcb6a7b11be60477b05a0a9c853
3,"want high density housing, with low footprint technologies surrounded by green / social / community space and linked to local business",f47d7c74d1cab86e0e9ab46a40560d606d019010a562847eccd581b6281a3e75
4,a medium-density thriving creative centre attracting talent and new residents from around the country and the world,f0db28cd42cc07ca108f62d7bb42b1c0ab0c0f36e8a81e434810bb66dfb559d2
5,Encourage more high density central city residential living,f185247fcf2f5372f31c2224b7a7c5a78d565d2cb0dfa6ab2782a631f1879aeb
6,Take note of places like central Barcelona; low-rise high density living with inviting social / commercial spaces at ground level.,3cb414c9511e341d2e02950f98d975c79dc862e8d2ca5d0ff03be5e327b86146
7,I don't want lots of apartments cheaply built and crammed in with no trees or open space around them. We don't want any more wall to wall concrete. We don't want cheap and nasty infill anywhere which will become ghettos in the future.,6c5ca1bb4f74d53e2fdf49c61f1865805335ed7a59ab810dfd20fdfa2bd41343
8,"Great central city apartment living. Low-rise, shared courtyards, no ugly battery hen developments. Quality and affordability",4b2f3a27207e35324c7eba1ef69f1c4612f54d7fdc1539f4f93f439854b6355c
9,"I want family and small child friendly spaces. Maybe high density living with purpose built childcare facilities for working families, safe walkways to and fro. Somehow incentives large companies to be based in the same areas to increase workers potential for work life balance with their families",8d8595527e2d9f0828bdd6446ef0582b17aac1aff9c841f20ccb379cde7ac4b1
10,More mixed use-retail / commercial / residential with some cultural facilities nearby. To bring vibrant mix into rundown / empty areas of CBD,06897651cb9e9cf84ad67085808b895e0a2db357c1ba481e15e23bba830c353f
11,"Mixed use spaces, dispersed with green spaces and the arts & creativity sectors at the heart of the city, not just a precinct, but throughout the city!",26234b6a0d1a4cbf03f84e894287239c5307759470ba20631555823c3d23d5b8
12,"All blocks / neighbourhoods should contain a vibrant mix of residential, retail, commercial, cultural, entertainment & hospitality spaces.",ac67ac23777895b0c7fdc5a1c1392f7447657213003ce6b474f6bb80bcf1e5f9
13,"Mixed use with residential, entertainment, retail + services, green spaces + seating.",91828f5928670690f0b78bdce685ddd393842b9ddd0cb5a07c9207f10aa362a9
14,"Open with a mix of retail areas, commercial, business & public parks",36ab80d0df4f64d7c47602170481f1688a4e229d34510341ef92ce15cbe55b2c
15,"mixed spaces, office, shopping and living in one area.",af14b279847db8650287a7ddeec46650e0770316bbf730e31f7c5702d404d482
16,"I want to see a mix of quiet spaces, memorial parks etc, grass spaces to sit and ponder and faster pace areas with night markets, late coffee shops, market space that would take up a whole block and be open everyday, including flower market, fruit and vegies, crafts, old bookshops, shops to wander in and practical shops. Low level buildings with a mix retail, office and living to gather. School and preschools close by.",db4a7f3f06c2d4b913b11e2aadb0ecfabf12dc8391ce9fecc08f14c891a32e93
17,"Multi-use buildings-retail, restaurants etc at ground level, residential, office space and niche stores above",3bf3c44bb68510b58c74f22845a0607fc1b0961c2a539fc56b76c8aeda12b13e
18,"More residential apartments interspersed with business, culture, and entertainment, Keep the centre alive 24/7.",ed510578a901e796ac5125501343966a600a8d951b57cc1859cc02a19af4be51
19,"Mixed use buildings! Retail, offices and apartments so the space is activated 24/7 leading to a safe and vibrant city.",77508a2e345c435696acfc0028a8a8fe2fbc16e3f1892b87ae13077a7147e8b3
20,"A mixture of living, shopping and entertainment, make the central city vibrant and alive 24 hours a day, must be safe.",3aa8ce628fbc8d31e0704c5266bde138f65dc08957e0d505bda5f2eaf0cc5da0
21,"Mix of homes business and entertainment. Open air entertainment area, so that people are more likely to live there and the place isn't an after dark ghetto.",cee6cbfa17547be1702bc4e35834750cdce593a90768aa7db2011e9e8e7c0b5a
22,"I want mixed use spaces, weekday weekend & night use safe & well lit",c63c501dc6aff5157fe2d2e9056ac547d929e9b8fd4ea6e87c2c7534c8338bbf
23,Apartments above shopping areas to encourage people into the city.,a6aebe164ecf87a44d167feb70dad62c20b008a65977d59ff240bd4d52f874db
24,"Vibrant city combining housing, tourism, entertainment, commerce with retail markets and green spaces",10182711aaef2c60f04928795e167222321daf0310036579801186fbb28b0f90
25,"I want a mix of retail office and living space, apartment inner city living so the city is vibrant at all hours. a safe environment",dbc5661033a2c034a7f5cb1949fc52941157d3f865fb04816b80ea4379dc4d26
26,"a vibrant business area with supporting restaurants and cafes, a variety of shops.",9d9cd7d94d7262c900059edd92bd7df48bd6d8cb096c5325f19d7e1e13518c90
27,"I would like the central city to be a mixture of green spaces (where buildings have come down or been demolished) shops, providing essential goods and services (but no cluster of take away / fast food outlets) and apartment buildings.",9b6ff18d97a62d7587c5047836596904c5cc93f5480d81f35a2b8125364b7db5
28,"We will know we have made the central city a great place because people will be back in it working, shopping, dining, enjoying a night out etc",995904e0611a32629da2e3243155325bd8701782296766619ad10e2dc468eb45
29,"Mixed use – business, retail, hospitality, entertainment plus low rise residential – to achieve vibrant, safe spaces that people want to be in.",b31b1b0702f2feea5e5c6152d37262f3574123431d7e6db8913b9d0b0b1f791e
30,"A mixture of retail, residential, arts, and commercial, lots of green space, green cycle belts connecting east west and north south.",cba49b100c80fdf0cebd5b6c5a799178edf897852dc70d2ba386db6bd578e06f
31,"Mix of businesses, residences, small parks, shops, cafes, gardens.",033586b5266eb0c7ecae59528016042591fe16c84177daf0593717b3a1e06c5b
32,"Encourage a mix of education, business, residential, green spaces.",e3250ff245f7625e324893fec116a8784493ea575fb55fa0f6c923c18d917e23
33,"Think retail ground floor, office space 1st floor and living space 2nd floor, with a garden roof!",0a54de3edc31c6620027dcda7f0a775cdd1fcc99743c9cfd719242bba63d50bd
34,"Apartments above shops and restaurants, with roof-top gardens and courtyards",15cb8c93b16ed9ea8ca1fef49ac123db54d78e3ec87d341bc6114e7da158fa49
35,"City squares similar to European cities with shops, cafes etc.. Second and third floors of these buildings could be used for offices or apartments.",dee32efe2e63c0238d7e060784ea14458e10668e4a9fa4ed95fc576078deab4c
36,The European style of retail underneath two or three floors of apartment accommodation surrounding central and grassed squares.,1e19dc12189253b893180afe301e933a9e2af4d20adcb1c2fb9359236c7c824c
37,"where whole blocks are cleared, consider creating 3 storey blocks with an inner square as in Barcelona, Spain. The buildings are used for shops on the outer street level and restaurants / bars in the inner sheltered square, which is paved, treed, artworks / sculptures etc.. On the second / third levels are business and accommodation.",17d833708f9e4ff0b1f8d86d5ae14109ada78cb75f1fc6caa68ccf5deebbd940
38,"cafes shops, on bottom level, apartment living on level two up, or commercial space.",63c34a3db03b3d0005dd7567d9fd4c330b813303059c9b2732a27bf31d25dfb6
39,light and airy spaces around shops and buildings,ceede5e542bd3e3d5c7e48b1585c30b0f3c2684896ff764f044bc207badfc0bb
40,"Eco friendly / sustainable buildings of imaginative design, plenty of light / space and greenery.",250e235b613126c9121f80be898288ce42a11ef2252df58f9ac1190bbdb80a05
41,I want boutique shopping precincts to make for a distinctive shopping and living experience rather than the kind of experience that is a replica of any other shopping centre.,cc7a2197a242e1386ba5d72512464a8be3dd0ca7356bf1d40dcec8a28a614c59
42,"Central city can't compete with malls so shouldn't try (stick to things that malls can't do, street markets, events, green spaces, entertainment and eateries).",01046946530623aaaf55b2a50c3df75b0b3cd372726dec733270292c6dc5e1a4
43,"No franchise shops in the retail spaces in the city, keep them in the malls.",58070be9d5de0041ffac511005f620bfac830f46c7e1fefd6005091a0c6f86c2
44,"Small low rise, walker friendly central city with special boutique shops",d7db9c533647ed6918839b0a7ddef580a849de1e00a2f806d032ec6c36a79da1
45,Retail space needs to be pedestrianised,063539e9687dc8bd704aeb495b0ba16baa38b33ddabacab69bbfa40d3e9269e6
46,Lots of pedestrian only mall areas paved with recycled bricks,dcaa716a71a3ae30e29290a6385d60b6e24deef2294130e82dd6e3f799f0f154
47,less traffic more pedestrian mall type areas,8f8b8bed410d7683a80f59d354f9a300517b4c1b6a29baa2f081f8d0f0603117
48,"I want pedestrian mall areas, like Cashel or New Regent street",55e81f61bc61a66eff25bc260adcf33d75236b9e3183e409b55c3edc46fc7021
49,"Lots of pedestrian mall areas, few cars, a variety of cafes, bookstores, and lots of green spaces.",5eec1333976394bd867c92eb5f555dc7bcb0278f894a33b78c3880446abbf664
50,"Make the CBD a pedestrian mall only, open areas, trams and no cars.",1333a887a0fb115b3bac7174c339063ff0483ab8ae1014ca50c0c301aaa54627
51,"Shared use space, like Cashel Mall was-pedestrians",13208074a42116d69c7646022b7a0bc7bd066a33e624d27d76f70c18a3dcac35
52,covered outdoor areas,2579c426935814425e3aaa1712c3ceb94eeb674c6e5280573b9678ff8d4dbf59
53,covered lanes linking retail shopping areas to create a village atmosphere.,af9dbe52fe28a54d6bf56b918ffc8e64bee4bcba2348848f9a29d91441cf878e
54,Cashel mall & ajoining areas with retrctable roof tht cover the whole st for bad wthr,40bd0f702976dc5511cd0aae669c689ca2e8d16c4651a7b21de1fd16429ec020
55,Cheap covered walkway to the central retail area.,8b7a5dce96714ae514d4d43d6e7d101a321c4a6c5fcc806ee1f69694fdfed51b
56,"Covering in cashel mall with clear roofing so light can will come in, gives the city a covered shopping area but different from mall.",f716d6a58f3b983bd26d8257dd437c87fc5b9842df94cff9f2653917ee49fa46
57,"a covered area that can be used for a market or meeting place, good access and pedestrian friendly",b76678b056d8288baca96e5d5484d16206127f2a2c27f5e3f71b998a660a1e24
58,"don't want Timezone arcades, $2 shops (not a positive image for a new vibrant CBD, malls are a better place for them)",6b08b4a1c0f294ec8abf74ce90f1ca3c3c630a9b77a20c650505f80a45f3fb30
59,"I want my old places back! Dux De Lux, Arts and crafts, concert venues, Smiths bookshop.",fd9246b7b2bd2cf2a6db4cb8e03e9d6558e59d12c5b209610f5526c6b4fadfaa
60,"I've missed the arts centre weekend market. Great eateries like the Dux de Lux, the restaurants along the strip etc.. And the nightlife, clubbing and bars are important for young people as we need to have a way to relax after studying and celebrate events. SOL Square was one of the best places in Christchurch.",71b55fc8ef3653fad989d248264efa8f764327b2c7dc78747854a41e8b5d3bcb
61,The Arts Centre was a regular haunt – I miss that – and especially the Dux.,86341cb219c0776e0428c376eb8c6ea70a474806005c5a0c6847e02e461eac44
62,"Cafes / restaurants. Markets with artisan products. Unique shops that were at the Arts Centre. Brew pubs – Twisted Hop / Dux de Lux, small speciality shops, Toi Toi for example. City library. Events – lantern festival",d5e942830eca61e82de275213c471c4d021fd68c5d7bf8464353e02f162447ba
63,I have missed shopping at Ballantynes and a small craft shop under the car park.,d881fadef41b46194e352105e7f4cf056fae0c7ee47998d6a53beda1ed71c143
64,"I have missed running / walking along the river through town, missed going to the central library, sitting in Cathedral Square, wandering around the shops and sitting at a café for lunch / coffee.",8b38b513964f9aefb0e47666b0fa8555f357f2e316de0fa3c0a53e44cfd3e0de
65,"Ballantynes, Dux, the lanes, cafes, arts centre, galleries, library. I used to have language school students I would bring in to the city. Miss have a day out, meeting friends, browsing, eating, ending up choosing an armload of books and music, or taking home goodies from the market.",d9668724bc34d09b65002703f756a529165004cdae8f169439ebfad9b760d4ea
66,"The Shuttle taking people around through town; the Central library; access to independent theatres – Metro, Academy; Arts Centre and the market; Christchurch Art Gallery exhibitors and talks; Dux de Lux; Museums; Robert McDougall Gallery; shopping at Ballantynes; inner city restaurants. The freedom to walk around the inner city.",192c54f00777e36134b0fdb4e85e462b15da0184af04d4bca7031dac78de58f3
67,"Ensure that redevelopment doesn't exclude or make unaffordable space for small business who bring vibrance, variety & character to the city",6f7f9b3151f3271c3cc49c878810f9f2309b65443df3edf27430d2f6b6fd9fda
68,small shop spaces for small start up shops to trial their concept. Use some of the council owned land. Incremental increase in rent until able to move to a private commercial space,5fed78a7a3250e31dc0a93d3cee14740edeef136e60a67b81c802832a56621c6
69,"Create more retail space, lower average rent means higher number of boutique stores and coffee shops all equals a more interesting inner city.",ff416bf74ae13bcc9f345bc401ab4f7c42cf31abcc08253dafdcccaef465e5ca
70,I want small business spaces at affordable rental,4a0b6a20a4807891130ddbe117a8b2c9743eb51ac4bd2e4c8b93a0168df3dbe3
71,Places for small businesses where rent is not too high,4e30087b46584d7eecf11cfd4f851174fb851fc48bf264e48ff3dc10a278c95e
72,Rent needs to be subsidised in some areas to attract up and coming designers and entrepreneurs who need cheap rent to get started.,55c80bf591f89871579ba2ae04202256ae7b1857a4dc98ff543fb323ebf6e72b
73,"Before the earthquakes the central city was looking very run down, somewhat like a third-world town, and was not well patronised. It had lost its role as the heart of the city. By contrast the suburban malls were always buzzing, so one wonders what the difference was. The malls attracted people because they were clean, it was easy to park, you were sheltered from the elements, you could do most of your shopping there, they had good coffee shops and good food was available. This has led some people to say we should have a suburban-type mall in the CBD. This would, however, make the CBD just another suburb and the city would then have no heart. However, if we could make some use of the things that make malls attractive, without building a mall, people would come back.",cf1c2cb488439654292ffad54f05ab6c3afe78b5cba5b1cb83e3d7c17ebf6ab9
74,"Don't want no big shopping centres in centre town, go to suburbs for that kind of experience",2ff45723c430589c7466110b68225003d5d314d5dec910b8f7d8875e32ec3bf5
75,Malls are horrible places.,279eac7a820d4ceef28a6950bc9e9a4daf882edc9c6145f1d0e75fbe2f9c7440
76,"I don't want big multi national owned mall that gives the city a bland as per all the other malls feel need eclectic, creative small enterprise in the central city",0611297b5d9254b03abaad827cc24bef367bfad630fe30bccf140d2b04206007
77,Big flash mall with all the top shops of the world. Create one big shopping mall in central city around Ballantynes with good parking and fantastic cafes and eateries.,2480169f9022d0190612d48dc7f4b5c43945b6bd009273e508b0391baf33cf25
78,"Sheltered outdoor malls, strategic parking areas / buildings so people travel on foot / bike.",55d5ef845070c3526f0b4d6a70a0930031fdae582a42bf276eac383fc531604a
79,"Massive shopping mall in CBD, like Eaton Centre in Toronto or MBK in Bangkok, people love malls, let them have one downtown, they draw people in.",5362924947683ec44c32eeeafad92d06d3fdf98b8ec5eea7ca2375592b80c7ed
80,"We have noticed that there is a trend towards building large indoor shopping centres in city centres. and these centres form the nucleus of the city's retail shopping. The reasons are obvious and, in our experience, are hugely successful. I am not talking about centres like Christchurch's South City or Auckland's Westfield, but something larger and more up-market. These centres are always anchored by one or two major department stores and contain numerous up-market specialty stores. They always have a large food court and sometimes cinemas. I think that Christchurch's need for such a centre is great. We lived in Toronto. While we were there they demolished an entire city block and built the Eaton Centre, which is a wonderful concept and is now the retail heart of the city. When we visited Toronto again last year, we found that the Eaton Centre was absolutely packed with shoppers all the time. The centre is entirely enclosed and has a huge arched glass roof that lets in plenty of natural light.",03c9d8d6509d6635480b2ebae768970ef2e2bfa17e8399f5b4178a482f4762c5
81,"People go to malls, have biggest and best mall close to the CBD with ice skating, movies etc then lead off to the nice boutique shops, cafes, Ballantynes. green spaces.",7b17ddbf20c580d91a52f73b54dea05aa8c63d5da507831e9cd326a9f71b06be
82,Cohesive opening hours for CBD businesses. Actual late night shopping on Thurs / Fri instead of a hodge-podge of open places.,dab2d73216d3bb32b982543bbf1ead1d5e6f0bd2ce962aef3584444965a468ff
83,a city centre that doesn't close at 5.30 pm.,100c53c98d7975f462d2909f9a2304314abed8a4ccd33a9f04eca6bc2ae1230e
84,A CBD retail area that is under management to regulate shopping hours,6311ad94163b4046987b038fdb9a749ca3582c8d0126e016f014de620d1aa2e6
85,Huge central market place (24 hours) where people meet and shop etc,1226e971cd4868a90f6d8edded32de10757cf04603dc8a24c19e1468a56d392e
86,Wellington has incredible New World Metro supermarkets. which offer significantly better food options for office workers and city residents than anything I've seen elsewhere. Attract one of these to the CBD along with plenty of office space and you're on to something!,db4e359823a40d3a59b2a979aebee3116f7e5a8f7b0c9ce840e1242de51ce4be
87,"Businesses, professions, retail, creative ventures, spaces for markets and arts and crafts, not sanitised and all the same, create variation.",242280c512c27dbce8b6ebe5725bc1145fb68f5b1a104a88345241e063a82e6a
88,"Access to small businesses – dentist, photo lab, optometrist, bike shops. These businesses need central city premises. Big business is often duplicated throughout the city in suburban offices and malls.",c7ec9b2fccd1cd04ead62c2e822f115182a3a78baa69c8b0b4a078717ebdc00a
89,Space for diversity of small businesses.,91121e5dd60bc25026f66835e88ec6984847910efbe095b69259913dc389b48a
90,Don't want central city dominated by souvenir shops for tourists,1bf0e8aa35c25e9db0cca2380553145c598f33ab98d10188ab90d70ed9f6da36
91,A centre that has 10 gift / New Zealand shops as a weird hub!,9dea03ce976005f1424df13bf0617faf613f7aea0dbd48ac0abf4e4e458e7062
92,no large mass produced souvenir shops round the Square,b61e40ba94e3fb94dcf81bae2df13e26c5be07690ff1723014a3f02348a1686e
93,"Replace the souvenir shops around the square with buildings of cultural interest (galleries, museums etc) and cafes.",9988dd17e3580ee654aa49adeebe507372c8cf8ed58e251d96a43fbad35b1b86
94,"In the past few years its [ the central city ] been full of tacky market type stalls, souvenir shops.",1d0203eb1418224062d248e8c169ba8aebef303bd92809a8447d8d72b57a6015
95,Concentrate on low rise buildings with retail / cafe space on the ground floor and office / living space above,d350e4bc69d6d393e8b91d8bed6460625a83fd73a66dfbc06d7165a207436f4c
96,"I don't want banks, insurance, etc taking up street level shopping space.",709ceeeb54112d4c5da4942de895fd8c714efb311e8226d8df558ff6c9bb797e
97,Ground floor business in the square should engage people like cafes & restaurants rather than shut off ones like banks that make it look dead,f2f9cb31841771b4446b42b8bb97d49367bc7feb72e3dc8aa9e50627252dc00c
98,"architecturally designed buildings, retail and cafes on the ground floor with apartment style living above. internal courtyards for sheltered inner city living with spaces that many residents can share.",bb381d13c1fa5c4653646245dd5f6c344320e8eb542c85d14f91d575f2addba5
99,"Stop banks and other dead institutions from hogging key public areas, eg the south side of The Square. Have cafes and restaurants instead.",8064782e44d2e18b990174f5f95102a144a150e45e4dd8740c0d624a71fe8398
100,The utilisation of ground floor space within buildings fronting the square is where bars and cafes should be. Encourage the ANZ and BNZ to vacant their ground floor tenancies. They are the wrong occupies of ground floor retail space in the square.,a900cd8d02d1ea13234a1482fcb9b1a2e4b20927960b06935937383391bfc912
101,The ANZ and BNZ banks occupying the two northern sunny street corners in Cathedral Square with their painted out windows or fully drawn blinds need to be a non-complying activity or presence in such important spaces.,609d3dc05db2699247b218ee26de2fbc4d978bd5420508461d30f490b95cf0de
102,"Occupy every ground floor in The Square with bars, cafes and restaurants. Intermingle the odd owner occupied boutique shop.",debdb37acc6bb4a035d76d671ad98081fa5e0589a891cfd77a78ea3669c1ae2a
103,"Ground floor activities in CBD should be retail and service, not blank commercial facades that became the norm in Cathedral Square.",713ead844fb3ff15ead4079f04c140806a777beff087f7e55b19a581e69ae08c
104,"I want Cathedral Square that feels safe at any time of the day or night, cafes, restaurants, concert areas, less business offices on the ground floor, vibrancy",976bc43afec38d9dd1b6b94edbdc13e81cab163eca28d9dd1dd22b8747adb6ba
105,"A place to be entertained with a vibrant feel-hotels, bars, cafes, restaurants, theatre, movies, green spaces-like leicester square, London",efabda3db3bd97a173665c823a20539c51a6224bcf944be771eee4c7a7468643
106,Need a centre that is packed with people day and night. Bring outdoor cafe spaces to the square and very close residential development,86dbdd9e451dbad3ce8eb2d08f6221dd906d2012f34c9b6b5f8ec0d5a1d1af42
107,"I would love to see more apartment living, green public spaces and to retain our cafe culture with cafes spilling out onto squares and courtyards like in European cities",fec1b98903ea5e8955487541dd6050c7b343a6f306df1ebb2fa267eed63a83b8
108,cafes and bars with outside spaces.,30697ac9e9d209ec28472d30a79f172705c3f0fff84ecca84121f6cde60e3e5b
109,"outside cafes, beautiful sculptures, outside music and dancing areas, bands.",710ac98075dad28b2020eab6eb759daef74f4f75efc606e98f62145d52b8930c
110,"Provide space, and encourage, cafes and restaurants to sprawl outdoors in summer.",34845fca84b696f1bcd563eaa84959ae0a88d38e091ff45cdc55a00d210356a6
111,Restaurants and cafes with open-air courtyards for al fresco dining.,006ea7eec818624a3cc887b25db0e7e8c46fc34806f37485d1c43cc3a9351338
112,many cafes with outdoor terraces in the central hub of the city.,b2bc7e04f36eb0361e1b32cd807fa5a48a879eb8fe7696f4135ffe83d9eeeca4
113,Lots of sheltered sunny outdoor areas outside cafe's and shops protected from the easterly wind where people can meet and sit,c4493f92bc41ee76227647c7f062ebbbc9da3120c0571f80b21f2bb007abe744
114,Cafes should be located on the south (sunny) sides of spaces and the CBD needs plenty of trees to mitigate against the killer easterly wind.,0876831c5b14196bc93667ebadddf0b34feac22e8d80e626ccf33114624fef79
115,Don't have bars in the very centre of the city that are open to 5 am. Either limit the opening hours or put them somewhere else,1ff8f1b01f0ef428e06ba0d0ae60e65c1ad6e65efa46f8a0571438e849f001ad
116,"I personally in favour of more Bars and Restaurants in the central and fine dining places in the CBD. But, rather than giving permits / consents for bars & restaurants like issuing raffle tickets, the council should come up with a programme for theme bars & restaurants.",8c4c623b962faec309d10c20428d28c15659e696911604b4d9c728b3747d8a1d
117,"have a real city mall, free parking, good shops, art cinemas, food cts, mall-wide vouchers, warm enclosed space.",d46dac762e024d144a56cbbc7894f12703e526484adc609b6aefd5295ca6a3ad
118,Create an area for cinemas.,09cdaf7dfc4859afe767ef1d893d3b69f0ea086b1ccd448514358b3c4dd3fdf0
119,a multiplex of cinema complete in the square,bb7439827211f02d8da9f687dd6ca0d3cf28ff4c9ab2b9010be28984f10e698b
120,"Art house cinema – really missing the Art Centre, Academy and Cloisters movie theatres.",bdda99d3ca08526443309e24fd4d4bc2a76bb76bb1842dc69a62812fab93d54d
121,Bring cinemas back to the square and create a venue there for the Court Theatre,c8083eb48fd7cf9c5a08344802bbc89ae344ea96a992da87e0b4fa6b35b39b51
122,"I remember as a child how I used to love going to the square. All the movie theatres were around it, you could go for a late supper, there were lunch time concerts, it was a dynamic, exciting place to be.",a8b6c1667055846e7cd1baeed91f5e1c3383da4b35f96797d0524118540acbda
123,Central city alternative movie theatres showing something other than Hollywood tripe.,659c1e1fd5c31263b203347f6b6d207ed236e02392bca026e137f8ab7f2096ae
124,"Nightlife! Performing Arts, plays, theatre, spaces for quirky arty cafes where conversations can be had over world class coffee & candles",7687059e86f660b6ff661866aaa3a6000228acdf64ace3238f76435d9ebb76c2
125,night life with safe places to wander.,42d43bfac4b34deaa48522c6a2c89e9842cbcae203f6e333c9e3bb05ffdea74f
126,We need to have a bright night life without dark areas where low life can congregate.,d284eaecee696e7c75793180ea963c1761b42a41b71a33092b386d097faddfdf
